"Login";"E-mail";"Starts at";"Ends at";"Rating";"Rating comment";"Role";"Device";
"JOSE PAOLO OVALLE BELMAR";"jovalle65@gmail.com";"2020-06-02 20:49:00";"2020-06-02 21:49:00";"";"";"host";"web";
"Escuela de Contadores Auditores de Santiago";"fernanda.lemunguir@gmail.com";"2020-06-02 20:50:00";"2020-06-02 21:48:00";"";"";"listener";"web";
"SEBASTIAN ESTEBAN CRESPO GOMEZ";"screspog019@gmail.com";"2020-06-02 20:32:00";"2020-06-02 21:49:00";"5";"";"listener";"web";
"BEATRIZ ANDREA OSORIO QUEUPAN";"bbiebsvictim@gmail.com";"2020-06-02 20:45:00";"2020-06-02 21:07:00";"";"";"listener";"web";
"DANIELA CATALINA CERDA MUÑOZ";"daniela.cerda.ipsma@gmail.com";"2020-06-02 21:20:00";"2020-06-02 21:21:00";"";"";"listener";"web";
"EVELYN BEATRIZ CHAVEZ MARQUEZ";"eve.mac1250@gmail.com";"2020-06-02 20:39:00";"2020-06-02 21:47:00";"";"";"listener";"web";
"PAULINA SCARLETT QUINTREQUEO SOTO";"paulinaquintrequeo2014@gmail.com";"2020-06-02 20:45:00";"2020-06-02 21:49:00";"";"";"listener";"web";
"EMILIA BELEN VALENCIA PALMA";"militavalencia730@gmail.com";"2020-06-02 20:38:00";"2020-06-02 21:49:00";"";"";"listener";"web";
"MACARENA CONSTANZA UBILLA BONTA";"maqita1330@gmail.com";"2020-06-02 20:47:00";"2020-06-02 21:49:00";"";"";"listener";"web";
