"Login";"E-mail";"Starts at";"Ends at";"Rating";"Rating comment";"Role";"Device";
"RODRIGO ALFONSO VELIZ SCHRADER";"rodrigo.velizs@gmail.com";"2020-06-02 08:20:00";"2020-06-02 09:48:00";"";"";"host";"web";
"PAOLO ENRIQUE PAVEZ PINTO";"slender88898@gmail.com";"2020-06-02 08:20:00";"2020-06-02 09:28:00";"";"";"listener";"web";
"BEATRIZ ANDREA OSORIO QUEUPAN";"bbiebsvictim@gmail.com";"2020-06-02 08:31:00";"2020-06-02 08:37:00";"";"";"listener";"web";
"GUSTAVO IGNACIO BARAHONA DURAN";"gustavo.barahona.d@gmail.com";"2020-06-02 08:30:00";"2020-06-02 08:58:00";"";"";"listener";"web";
"FRANCESCO GIOVANN CALCAGNO CORTES";"calcagnofrancesco99@gmail.com";"2020-06-02 08:50:00";"2020-06-02 09:48:00";"";"";"listener";"web";
"MAXIMILIANO IGNACIO ALARCON VERGARA";"alarconmaximiliano54@gmail.com";"2020-06-02 08:10:00";"2020-06-02 09:48:00";"";"";"listener";"web";
"REBECA SARA DIAZ DIAZ";"rebe.diaz07@gmail.com";"2020-06-02 08:34:00";"2020-06-02 09:48:00";"";"";"listener";"web";
"YESSENIA ZULOAGA COBEÑAS";"yesseniazuloaga@gmail.com";"2020-06-02 09:31:00";"2020-06-02 09:48:00";"";"";"listener";"web";
