"Login";"E-mail";"Starts at";"Ends at";"Rating";"Rating comment";"Role";"Device";
"ALVARO LOPEZ ORDOÑEZ";"abogadoalvaro.lopez@gmail.com";"2020-06-16 08:23:00";"2020-06-16 09:50:00";"";"";"host";"web";
"CRISTOBAL IGNACIO MARTINEZ MARDONES";"criss.alexander178@gmail.com";"2020-06-16 08:36:00";"2020-06-16 09:40:00";"";"";"listener";"web";
"JORGE IGNACIO AGUILERA VILLANUEVA";"jaguilerav2403@gmail.com";"2020-06-16 09:13:00";"2020-06-16 09:40:00";"";"";"listener";"web";
"MACARENA ANDREA AGUILERA BAEZA";"maqiis15@gmail.com";"2020-06-16 08:22:00";"2020-06-16 09:40:00";"";"";"listener";"web";
"Escuela de Contadores Auditores de Santiago";"fernanda.lemunguir@gmail.com";"2020-06-16 09:41:00";"2020-06-16 09:44:00";"";"";"listener";"web";
"CRISTOBAL ALEJANDRO DIAZ ORELLANA";"crisantos580@gmail.com";"2020-06-16 09:41:00";"2020-06-16 09:41:00";"";"";"listener";"web";
