"Login";"E-mail";"Starts at";"Ends at";"Rating";"Rating comment";"Role";"Device";
"FRANCISCO VERDAGUER ALBORNOZ";"francisco.verdaguer@gmail.com";"2020-06-03 15:33:00";"2020-06-03 17:57:00";"";"";"host";"web";
"JORGE ROBERTO ZUÑIGA DAZA";"jzunigad96@gmail.com";"2020-06-03 15:48:00";"2020-06-03 17:57:00";"";"";"listener";"web";
"Escuela de Contadores Auditores de Santiago";"fernanda.lemunguir@gmail.com";"2020-06-03 16:14:00";"2020-06-03 16:52:00";"";"";"listener";"web";
"CARLOS ANDRES QUINTERO SERNA";"quins.carlos@gmail.com";"2020-06-03 16:17:00";"2020-06-03 17:57:00";"";"";"listener";"web";
"CLAUDIA PAOLA RODRIGUEZ VELASQUEZ";"cprv96@gmail.com";"2020-06-03 15:31:00";"2020-06-03 17:03:00";"";"";"listener";"web";
"MARIA PAZ HERNANDEZ CARO";"mary_paz_7925@hotmail.com";"2020-06-03 15:43:00";"2020-06-03 17:07:00";"";"";"listener";"web";
"PAULA FRANCISCA ROJAS ESTAY";"paularojasestay@hotmail.com";"2020-06-03 15:46:00";"2020-06-03 17:25:00";"";"";"listener";"web";
"BARBARA ALEJANDRA VARGAS BECERRA";"barbara.vargas.becerra@gmail.com";"2020-06-03 16:01:00";"2020-06-03 17:57:00";"";"";"listener";"web";
"KARIN DEL CARMEN COLIL LEPE";"k_merlina@hotmail.com";"2020-06-03 15:41:00";"2020-06-03 17:57:00";"";"";"listener";"web";
