"Login";"E-mail";"Starts at";"Ends at";"Rating";"Rating comment";"Role";"Device";
"GERARDO MARTIN SILVA MARCHANT";"mrtn.silva@gmail.com";"2020-06-03 18:45:00";"2020-06-03 20:17:00";"";"";"host";"web";
"SEBASTIAN GUSTAVO APABLAZA FUENTES";"sebastian.apablaza@gespania.cl";"2020-06-03 18:47:00";"2020-06-03 20:16:00";"";"";"listener";"web";
"KATHERINE ANDREA ARMIJO UMAÑA";"kandrea.armijo@gmail.com";"2020-06-03 18:51:00";"2020-06-03 19:14:00";"";"";"listener";"web";
"MAURA IGNACIA LIZANA ARAYA";"maura902@gmail.com";"2020-06-03 19:24:00";"2020-06-03 20:17:00";"";"";"listener";"web";
"TALIA VERENISE CARTAGENA ROJAS";"taalia.cartagena@gmail.com";"2020-06-03 19:48:00";"2020-06-03 19:50:00";"";"";"listener";"web";
"ROXANA ANDREA LEIVA LEVIÑANCO";"roxana_leiva@yahoo.com";"2020-06-03 19:01:00";"2020-06-03 20:17:00";"";"";"listener";"web";
"DAVID ISAAC CASTRO FLORES";"dc.castrof@gmail.com";"2020-06-03 19:11:00";"2020-06-03 20:17:00";"";"";"listener";"web";
"ANTONIA AMALIA SANDOVAL HERRERA";"a.sandoval.h98@gmail.com";"2020-06-03 18:41:00";"2020-06-03 20:17:00";"";"";"listener";"web";
"SANDRA SOLANGE GUERRA CORTEZ";"guerracortezs1@gmail.com";"2020-06-03 18:55:00";"2020-06-03 20:17:00";"";"";"listener";"web";
