"Login";"E-mail";"Starts at";"Ends at";"Rating";"Rating comment";"Role";"Device";
"DANIEL ALFREDO INOSTROZA CATALAN";"inostroza.da@gmail.com";"2020-06-08 08:26:00";"2020-06-08 09:45:00";"";"";"host";"web";
"MATIAS ANTONIO MACHUCA HAOA";"matiashaoa97@gmail.com";"2020-06-08 08:30:00";"2020-06-08 09:41:00";"";"";"listener";"web";
"FRANCISCA IGNACIA SOTO FERNANDEZ";"franciscaisfdez@gmail.com";"2020-06-08 08:30:00";"2020-06-08 09:43:00";"";"";"listener";"web";
"ALEXANDER MAURICIO BECERRA ESCUDERO_1";"atomzeus57@gmail.com";"2020-06-08 08:29:00";"2020-06-08 09:45:00";"";"";"listener";"web";
"CAMILA BELEN RAMIREZ CARDENAS";"camilabrc96@gmail.com";"2020-06-08 08:51:00";"2020-06-08 09:45:00";"";"";"listener";"web";
"JONATHAN ESTEBAN LEPE ABAD";"jonathanlepe96@gmail.com";"2020-06-08 08:36:00";"2020-06-08 09:45:00";"";"";"listener";"web";
"VANESSA ALINE FARIAS BARAHONA";"vanesywuis14@gmail.com";"2020-06-08 08:31:00";"2020-06-08 09:44:00";"";"";"listener";"web";
"CAMILA FERNANDA AMIGO BARRAZA";"camilaskp@gmail.com";"2020-06-08 08:44:00";"2020-06-08 09:45:00";"";"";"listener";"web";
"XIMENA ORTIZ IPINZA";"ortizipinza@gmail.com";"2020-06-08 08:35:00";"2020-06-08 09:45:00";"";"";"listener";"web";
