"Login";"E-mail";"Starts at";"Ends at";"Rating";"Rating comment";"Role";"Device";
"RODRIGO ALFONSO VELIZ SCHRADER";"rodrigo.velizs@gmail.com";"2020-06-18 08:22:00";"2020-06-18 09:56:00";"";"";"host";"web";
"MARÍA JOSÉ MARTINEZ PONCE";"mariajose.martinezp@gmail.com";"2020-06-18 08:30:00";"2020-06-18 09:55:00";"";"";"listener";"web";
"MARTIN ALONSO DIAZ  MENDEZ";"mantincinho10.madm@gmail.com";"2020-06-18 09:04:00";"2020-06-18 09:55:00";"";"";"listener";"web";
"Escuela de Contadores Auditores de Santiago";"fernanda.lemunguir@gmail.com";"2020-06-18 09:48:00";"2020-06-18 09:48:00";"";"";"listener";"web";
"YASMIN MICHELLE ROBLEDO GARRIDO";"yasminrobledo1@gmail.com";"2020-06-18 09:46:00";"2020-06-18 09:53:00";"";"";"listener";"web";
"ROMINA ASUNCION MORALES LOPEZ";"romoralesl21@gmail.com";"2020-06-18 08:47:00";"2020-06-18 09:56:00";"";"";"listener";"web";
