"Login";"E-mail";"Starts at";"Ends at";"Rating";"Rating comment";"Role";"Device";
"FELIPE BUSTOS BOBADILLA";"felipebustosbobadilla@gmail.com";"2020-06-11 10:11:00";"2020-06-11 11:41:00";"";"";"host";"web";
"CAMILA JESUS BUSTAMANTE LEMUS";"camilajesusbustamante0707@gmail.com";"2020-06-11 10:38:00";"2020-06-11 11:41:00";"";"";"listener";"web";
"CRISTOBAL ALEJANDRO DIAZ ORELLANA";"crisantos580@gmail.com";"2020-06-11 10:11:00";"2020-06-11 11:41:00";"";"";"listener";"web";
"VANESSA BEATRIZ MEZA CACERES";"vmezac.22@gmail.com";"2020-06-11 10:15:00";"2020-06-11 11:12:00";"";"";"listener";"web";
"Escuela de Contadores Auditores de Santiago";"fernanda.lemunguir@gmail.com";"2020-06-11 11:37:00";"2020-06-11 11:37:00";"";"";"listener";"web";
"MACARENA ANDREA AGUILERA BAEZA";"maqiis15@gmail.com";"2020-06-11 10:10:00";"2020-06-11 11:41:00";"";"";"listener";"web";
"EDGAR CRISTIAN LEAL ORTIZ";"edgarleal996@gmail.com";"2020-06-11 11:18:00";"2020-06-11 11:41:00";"";"";"listener";"web";
"MICHAEL SEGUNDO JARA PROBOSTE";"jaraproboste@gmail.com";"2020-06-11 10:12:00";"2020-06-11 11:41:00";"";"";"listener";"web";
"JORGE IGNACIO AGUILERA VILLANUEVA";"jaguilerav2403@gmail.com";"2020-06-11 10:12:00";"2020-06-11 11:41:00";"";"";"listener";"web";
