"Login";"E-mail";"Starts at";"Ends at";"Rating";"Rating comment";"Role";"Device";
"RODRIGO ALFONSO VELIZ SCHRADER";"rodrigo.velizs@gmail.com";"2020-06-11 08:11:00";"2020-06-11 09:56:00";"";"";"host";"web";
"ROMINA ASUNCION MORALES LOPEZ";"romoralesl21@gmail.com";"2020-06-11 08:30:00";"2020-06-11 08:43:00";"";"";"listener";"web";
"FRANCESCO GIOVANN CALCAGNO CORTES";"calcagnofrancesco99@gmail.com";"2020-06-11 08:32:00";"2020-06-11 09:56:00";"";"";"listener";"web";
"DENISSE FERNANDA PATRICIA GARATE CABRERA";"denissegarate.c@gmail.com";"2020-06-11 08:34:00";"2020-06-11 09:59:00";"";"";"listener";"web";
"MARTIN ALONSO DIAZ  MENDEZ";"mantincinho10.madm@gmail.com";"2020-06-11 09:03:00";"2020-06-11 09:56:00";"";"";"listener";"web";
"EVELYN BEATRIZ CHAVEZ MARQUEZ";"eve.mac1250@gmail.com";"2020-06-11 08:33:00";"2020-06-11 09:56:00";"";"";"listener";"web";
"Escuela de Contadores Auditores de Santiago";"fernanda.lemunguir@gmail.com";"2020-06-11 09:45:00";"2020-06-11 09:59:00";"";"";"listener";"web";
"GUSTAVO IGNACIO BARAHONA DURAN";"gustavo.barahona.d@gmail.com";"2020-06-11 08:39:00";"2020-06-11 09:56:00";"";"";"listener";"web";
"FRANCISCA CATALINA GARCIA HUBER";"fragahu@gmail.com";"2020-06-11 08:56:00";"2020-06-11 09:56:00";"";"";"listener";"web";
