"Login";"E-mail";"Starts at";"Ends at";"Rating";"Rating comment";"Role";"Device";
"GERARDO MARTIN SILVA MARCHANT";"mrtn.silva@gmail.com";"2020-06-17 18:51:00";"2020-06-17 20:25:00";"";"";"host";"web";
"JORGE ADAN CONTRERAS VALDEBENITO";"koke17.cv@gmail.com";"2020-06-17 19:07:00";"2020-06-17 19:09:00";"";"";"listener";"web";
"SEBASTIAN GUSTAVO APABLAZA FUENTES";"sebastian.apablaza@gespania.cl";"2020-06-17 18:55:00";"2020-06-17 20:09:00";"";"";"listener";"web";
"SANDRA SOLANGE GUERRA CORTEZ";"guerracortezs1@gmail.com";"2020-06-17 19:18:00";"2020-06-17 20:25:00";"";"";"listener";"web";
"ROXANA ANDREA LEIVA LEVIÑANCO";"roxana_leiva@yahoo.com";"2020-06-17 19:01:00";"2020-06-17 20:25:00";"";"";"listener";"web";
"MARITZA ANDREA ROJAS MUÑOZ";"rojasm.maritza@gmail.com";"2020-06-17 18:55:00";"2020-06-17 20:25:00";"";"";"listener";"web";
"KATHERINE ANDREA ARMIJO UMAÑA";"kandrea.armijo@gmail.com";"2020-06-17 18:57:00";"2020-06-17 20:25:00";"";"";"listener";"web";
"DAYANNA SCARLETTE ROMERO MIÑOZ";"dayannahenecia2014@gmail.com";"2020-06-17 18:56:00";"2020-06-17 20:25:00";"";"";"listener";"web";
