"Login";"E-mail";"Starts at";"Ends at";"Rating";"Rating comment";"Role";"Device";
"MARIANO DESIDERIO MOLINA HERNANDEZ";"mariano.molina7@htomail.com";"2020-07-01 20:38:00";"2020-07-01 22:01:00";"";"";"host";"web";
"Francisca Martinez Reyes";"franciscareyes9.06@gmail.com";"2020-07-01 20:49:00";"2020-07-01 20:53:00";"";"";"listener";"web";
"ESTEBAN ALBERTO CACERES GUAJARDO";"esteban.albertocg@gmail.com";"2020-07-01 20:40:00";"2020-07-01 21:44:00";"";"";"listener";"web";
"MISAEL IGNACIO LAVIN GONZALEZ";"lavinmisael@gmail.com";"2020-07-01 20:43:00";"2020-07-01 21:44:00";"";"";"listener";"web";
"JORGE ALEJANDRO VARGAS ZAMBRANO";"jorgee.vaargas@gmail.com";"2020-07-01 20:43:00";"2020-07-01 21:55:00";"";"";"listener";"web";
"MARICELA PAZ GUZMAN DOMINGUEZ";"maricelapazgd@gmail.com";"2020-07-01 20:49:00";"2020-07-01 22:00:00";"";"";"listener";"web";
"CAMILA GEORGINA FARIAS MUÑOZ";"cgfariasm@gmail.com";"2020-07-01 20:21:00";"2020-07-01 22:01:00";"";"";"listener";"web";
